{
  "id": "credit-points-child-2026",
  "category": "tax",
  "subcategory": "credit-points",
  "title": "נקודות זיכוי לילדים",
  "description": "הורים זכאים לנקודות זיכוי לפי גיל הילד: 1.5 בשנת לידה ובשנה ה-18, 2.5 בגילאי 1-5, 1 בגילאי 6-17.",
  "effective_from": "2017-01-01",
  "rules": {
    "type": "credit_points",
    "value": {
      "age_0": 1.5,
      "age_1_5": 2.5,
      "age_6_17": 1,
      "age_18": 1.5
    },
    "unit": "points/child",
    "conditions": {
      "has_children": true,
      "parent_role": [
        "mother",
        "father"
      ]
    },
    "calculation": "סכום נקודות לכל ילד × 242 ש\"ח",
    "calculation_fn": "calcChildCreditPoints"
  },
  "applies_to": [
    "with_children",
    "all_employees"
  ],
  "sources": [
    {
      "name": "rashut_hamisim",
      "url": "https://www.gov.il/he/departments/topics/tax_credit_points",
      "document_id": "child-credit-points",
      "fetched_at": "2026-12-09T06:00:00Z"
    }
  ],
  "metadata": {
    "first_seen": "2026-12-09T06:00:00Z",
    "last_updated": "2026-12-09T06:00:00Z",
    "version": 1,
    "ai_confidence": 1,
    "human_reviewed": true,
    "expert_approved": true
  },
  "impact_estimate": {
    "users_affected": "~40% of users",
    "average_correction_nis": 363
  },
  "legal_disclaimer": "מבוסס על: פקודת מס הכנסה סעיף 40."
}