{
  "id": "credit-points-single-parent-2026",
  "category": "tax",
  "subcategory": "credit-points",
  "title": "נקודת זיכוי להורה יחיד",
  "description": "הורה יחיד (גרוש/אלמן/רווק עם ילדים בלבד במשמורתו) זכאי לנקודת זיכוי נוספת.",
  "effective_from": "2018-01-01",
  "rules": {
    "type": "credit_points",
    "value": 1,
    "unit": "points",
    "conditions": {
      "marital_status": [
        "single",
        "divorced",
        "widowed"
      ],
      "has_children": true,
      "sole_custody": true
    },
    "calculation": "1 × 242 ש\"ח = 242 ש\"ח/חודש",
    "calculation_fn": "calcCreditPoints"
  },
  "applies_to": [
    "single_parent",
    "with_children"
  ],
  "sources": [
    {
      "name": "rashut_hamisim",
      "url": "https://www.gov.il/he/departments/topics/tax_credit_points",
      "fetched_at": "2026-12-09T06:00:00Z"
    }
  ],
  "metadata": {
    "first_seen": "2026-12-09T06:00:00Z",
    "last_updated": "2026-12-09T06:00:00Z",
    "version": 1,
    "ai_confidence": 0.98,
    "human_reviewed": true,
    "expert_approved": true
  },
  "impact_estimate": {
    "users_affected": "~8% of users",
    "average_correction_nis": 242
  },
  "legal_disclaimer": "מבוסס על: פקודת מס הכנסה סעיף 40א."
}