{
  "id": "credit-points-academic-degree-2026",
  "category": "students",
  "subcategory": "credit-points",
  "title": "נקודות זיכוי לבעלי תואר אקדמי",
  "description": "בעלי תואר ראשון זכאים לנקודה אחת לשנה במשך שנה, בעלי תואר שני — חצי נקודה לשנה במשך שנה. החל מהשנה שאחרי סיום הלימודים.",
  "effective_from": "2014-01-01",
  "rules": {
    "type": "credit_points",
    "value": {
      "bachelor": 1,
      "masters": 0.5,
      "phd": 0.5
    },
    "unit": "points (1 year only)",
    "conditions": {
      "degree_completed": true,
      "within_years_after": 1
    },
    "calculation": "נקודה לשנה × 242 ש\"ח, רק שנה אחת",
    "calculation_fn": "calcDegreeCredit"
  },
  "applies_to": [
    "student_bachelor",
    "student_masters",
    "student_phd"
  ],
  "sources": [
    {
      "name": "rashut_hamisim",
      "url": "https://www.gov.il/he/departments/topics/tax_credit_academic_degree",
      "fetched_at": "2026-12-09T06:00:00Z"
    }
  ],
  "metadata": {
    "first_seen": "2026-12-09T06:00:00Z",
    "last_updated": "2026-12-09T06:00:00Z",
    "version": 1,
    "ai_confidence": 0.96,
    "human_reviewed": true,
    "expert_approved": true
  },
  "impact_estimate": {
    "users_affected": "~15% of users",
    "average_correction_nis": 242
  },
  "legal_disclaimer": "מבוסס על: פקודת מס הכנסה סעיף 40ג, ד."
}