{
  "id": "tax-zones-periphery-2026",
  "category": "periphery",
  "subcategory": "tax-zones",
  "title": "הנחה במס הכנסה לתושבי יישובי ספר ופריפריה",
  "description": "תושבי יישובים מוטבים זכאים להנחה של 7%-25% במס הכנסה (עד תקרה שנתית) — תלוי באזור.",
  "effective_from": "2026-01-01",
  "rules": {
    "type": "tax_exemption",
    "value": {
      "categoryA": 0.07,
      "categoryB": 0.1,
      "categoryC": 0.13,
      "categoryD": 0.2,
      "categoryE": 0.25
    },
    "unit": "%",
    "conditions": {
      "residence_zone": "periphery_certified"
    },
    "calculation": "אחוז הנחה × מס מחושב, עד תקרה שנתית של ~250K ש\"ח",
    "calculation_fn": "calcPeripheryDiscount"
  },
  "applies_to": [
    "periphery_resident",
    "all_employees"
  ],
  "sources": [
    {
      "name": "rashut_hamisim",
      "url": "https://www.gov.il/he/departments/topics/periphery_settlements",
      "document_id": "priority-zones-2026",
      "fetched_at": "2026-12-09T06:00:00Z"
    }
  ],
  "metadata": {
    "first_seen": "2026-12-09T06:00:00Z",
    "last_updated": "2026-12-09T06:00:00Z",
    "version": 1,
    "ai_confidence": 0.95,
    "human_reviewed": true,
    "expert_approved": true
  },
  "impact_estimate": {
    "users_affected": "~12% of users",
    "average_correction_nis": 1450
  },
  "legal_disclaimer": "מבוסס על: פקודת מס הכנסה סעיף 11. הרשימה מתעדכנת כל שנה — בדוק את היישוב שלך באתר רשות המסים."
}